[
  {
    "name": "Alts Secreta I",
    "category": "secreta",
    "icon": "special",
    "drop": "Alters",
    "rate": 9,
    "stat": {
      "hp": -10,
      "potency": 1,
      "floorPotency": 1,
      "damageResist": -1
    }
  },
  {
    "name": "Alts Secreta II",
    "category": "secreta",
    "icon": "special",
    "drop": "Alters",
    "rate": 9,
    "stat": {
      "hp": -10,
      "potency": 1.5,
      "floorPotency": 1.5,
      "damageResist": -1.5
    },
    "exchange": {
      "Alts Secreta I": 10,
      "Photon Quartz": 10,
      "Dualomite": 10
    }
  }
]
